ticker,name,as_of_date,finmind_price_date,n_constituents,max_weight_id,max_weight_name,max_weight_pct,hhi,eff_n,weight_sum_pct,data_source,notes
0050,Yuanta Taiwan Top 50,2026-06-08,2026-06-08,36,2330,台積電,57.21,0.3422,2.92,92.92,Yuanta PCF (NUXT weights),residual bucket 7.1%
006208,Fubon Taiwan Top 50,2026-06-08,2026-06-08,36,2330,台積電,57.21,0.3422,2.92,92.92,Proxy: same FTSE Taiwan 50 as 0050,residual bucket 7.1%; automated PCF incomplete—see Appendix notes
0056,Yuanta Taiwan Dividend Plus,2026-06-08,2026-06-08,39,kE,ku,9.30,0.0643,15.55,81.94,Yuanta PCF (NUXT weights),residual bucket 18.1%
00878,Cathay MSCI Taiwan ESG Sustainability High Dividend Yield,2026-06-09,2026-06-08,30,2382,廣達,10.51,0.0464,21.55,96.29,"Cathay cwapi GetIndexStockWeights (FundCode=CN, PCF posting date in payload)",residual bucket 3.7%
00919,Capital Taiwan Select High Dividend,2026-06-08,2026-06-08,58,2882,國泰金,12.24,0.0640,15.63,98.12,"Pocket.tw ETF holdings API (DtNo 59449513, M722; mirrors issuer PCF)",residual bucket 1.9%
00929,Fuh Hwa Taiwan Technology Dividend Highlight,2026-06-08,2026-06-08,50,2303,聯電,12.72,0.0496,20.17,98.52,"Pocket.tw ETF holdings API (DtNo 59449513, M722; mirrors issuer PCF)",residual bucket 1.5%
